{"catalog_hash":"sha256:2dbdd999dd8234645151834676861ca3ccbd244314488d080c260d20503e49c4","generator":{"adapter_id":"grounding_to_typed_facts","adapter_version":"1.0.0","as_of":"2026-08-03T23:59:59.999Z","fixture_hashes":{"conditional":{"cross_market_absent":"sha256:ade69c20761f24c22bfac5a5dea55d5124484cc2567c7d46c4b991e89bd526a6","equity_non_us":"sha256:5b7cb9909f6824011e9e6034f2b26962499b371edb09ed3f916e584ea11bb221","equity_us":"sha256:9faca394b53c7ff4c1a0ac4daff21de74950d6945c0b13b7296a799cb0cb18ab","fund":"sha256:1e53535d561a013adbe0c6927cafd57fb5204c935ac6d591eb3ba0a179f3a520","index":"sha256:e6df035c0bc7e7154f6f853b99d7aeb2ed8bec9e556546f6af46adb7c5c93b72","options_absent":"sha256:b21534e8ccc86391146899bbac151966e8b1003a355910237b5e8a78b8bebf61"},"maximal":"sha256:ab329a84bab0fe43dadc5b8e34e52d05c696820a8e0e5045e119ea1a59403518","section":{"basket_news":"sha256:b2dd89e91c8f7d8a37f34c4e655f88486badfa1a9057320e38859a0af69daeb6","cross_market":"sha256:d911ebc6f787dd5a73571a22123d1e42d915d00712f214210e43ae62c35e4822","fundamentals":"sha256:9166bfc0e82fd3230fb505d8332ea4b0ce208478ce4ba0956041787d8d1ca3aa","insider_ownership":"sha256:8a008251b2c78afc119f3d98a3f45d622c1416eaa72ae12c87bc43b606388044","instrument_aggregate":"sha256:3cc914867b4fad90b07d74c7cc09247c59692ed9b7c50064cc6f3514d8a655f8","macro_series":"sha256:5d22fcd611fb0c409156d6e30607eda798054fbdd06bb92e73e479acbca6d913","market_history":"sha256:5e733d8bab8b40b72d01aed46bca3561b0c84cdb2e78fdb8d2420a1f130f3e46","options":"sha256:441adfc8f969db3490c4efe3f2f86be1d5b5245e16eabd25025246c8bd0473d2","quote":"sha256:7a9218cb67341b4794a3ecda020351593a79d2c5559d8cca465666b3073355d7","screen":"sha256:e9d736de3c12f46891205ba4f15f62dcae2a1b5b493fff96a55c84b6564c0868"}},"precedence_inferred_by_call_order":[],"script":"scripts/build-fact-producer-catalog.mjs"},"hash_domain":"alphacouncil.typed-fact-producers.v1","no_producer":[{"critical":false,"fact_id":"accounting.accruals","master_ids":["master_forensic_short"],"roles":["optional"]},{"critical":false,"fact_id":"accounting.audit_changes","master_ids":["master_forensic_short"],"roles":["optional"]},{"critical":false,"fact_id":"accounting.off_balance_sheet","master_ids":["master_burry"],"roles":["optional"]},{"critical":false,"fact_id":"accounting.policy_choices","master_ids":["master_burry"],"roles":["optional"]},{"critical":false,"fact_id":"business.complexity","master_ids":["master_munger"],"roles":["optional"]},{"critical":false,"fact_id":"business.model.explainability","master_ids":["master_buffett","master_duan_yongping"],"roles":["optional"]},{"critical":false,"fact_id":"business.scaling_economics","master_ids":["master_jhunjhunwala"],"roles":["optional"]},{"critical":false,"fact_id":"business.ten_year_durability","master_ids":["master_li_lu"],"roles":["optional"]},{"critical":false,"fact_id":"business.two_minute_story","master_ids":["master_lynch"],"roles":["optional"]},{"critical":false,"fact_id":"business.unit_expansion","master_ids":["master_lynch"],"roles":["optional"]},{"critical":false,"fact_id":"capital_allocation.history","master_ids":["master_li_lu","master_munger"],"roles":["optional"]},{"critical":false,"fact_id":"capital_structure.seniority","master_ids":["master_burry","master_klarman"],"roles":["optional"]},{"critical":false,"fact_id":"catalyst.change_levers","master_ids":["master_ackman"],"roles":["optional"]},{"critical":false,"fact_id":"catalyst.implementation_cost","master_ids":["master_ackman"],"roles":["optional"]},{"critical":false,"fact_id":"catalyst.path","master_ids":["master_klarman","master_pabrai"],"roles":["optional"]},{"critical":false,"fact_id":"catalyst.timeline","master_ids":["master_ackman"],"roles":["optional"]},{"critical":false,"fact_id":"catalyst.verifiability","master_ids":["master_forensic_short"],"roles":["optional"]},{"critical":false,"fact_id":"company.capture_rate","master_ids":["master_cathie_wood"],"roles":["optional"]},{"critical":false,"fact_id":"company.category","master_ids":["master_lynch"],"roles":["optional"]},{"critical":false,"fact_id":"credit.debt_service","master_ids":["master_dalio"],"roles":["optional"]},{"critical":false,"fact_id":"credit.financing_conditions","master_ids":["master_soros"],"roles":["optional"]},{"critical":false,"fact_id":"credit.financing_runway","master_ids":["master_pabrai"],"roles":["optional"]},{"critical":false,"fact_id":"credit.maturity_schedule","master_ids":["master_burry","master_dalio"],"roles":["optional"]},{"critical":false,"fact_id":"culture.integrity_events","master_ids":["master_duan_yongping"],"roles":["optional"]},{"critical":false,"fact_id":"customer.retention","master_ids":["master_fisher"],"roles":["optional"]},{"critical":false,"fact_id":"cycle.credit_conditions","master_ids":["master_marks"],"roles":["optional"]},{"critical":false,"fact_id":"cycle.investor_behavior","master_ids":["master_marks"],"roles":["optional"]},{"critical":false,"fact_id":"cycle.position","master_ids":["master_lynch"],"roles":["optional"]},{"critical":false,"fact_id":"decision.coupled_assumptions","master_ids":["master_munger"],"roles":["optional"]},{"critical":false,"fact_id":"distress.recovery_waterfall","master_ids":["master_klarman","master_pabrai"],"roles":["optional"]},{"critical":false,"fact_id":"earnings.revision_breadth","master_ids":["master_druckenmiller"],"roles":["optional"]},{"critical":false,"fact_id":"economics.unit_margin","master_ids":["master_cathie_wood"],"roles":["optional"]},{"critical":true,"fact_id":"event.expiry_coverage","master_ids":["master_taleb"],"roles":["optional","eligibility"]},{"critical":false,"fact_id":"execution.liquidity","master_ids":["master_natenberg","master_thorp"],"roles":["optional"]},{"critical":true,"fact_id":"execution.round_trip_cost","master_ids":["master_taleb"],"roles":["optional","eligibility"]},{"critical":false,"fact_id":"execution.slippage","master_ids":["master_sinclair"],"roles":["optional"]},{"critical":false,"fact_id":"execution.total_cost","master_ids":["master_simons"],"roles":["optional"]},{"critical":false,"fact_id":"execution.turnover","master_ids":["master_simons"],"roles":["optional"]},{"critical":false,"fact_id":"expectations.consensus","master_ids":["master_marks"],"roles":["optional"]},{"critical":false,"fact_id":"factor.beta_exposure","master_ids":["master_asness"],"roles":["optional"]},{"critical":false,"fact_id":"factor.crowding","master_ids":["master_asness"],"roles":["optional"]},{"critical":false,"fact_id":"factor.momentum_exposure","master_ids":["master_asness"],"roles":["optional"]},{"critical":false,"fact_id":"factor.quality_exposure","master_ids":["master_asness"],"roles":["optional"]},{"critical":false,"fact_id":"factor.sector_exposure","master_ids":["master_asness"],"roles":["optional"]},{"critical":false,"fact_id":"factor.value_exposure","master_ids":["master_asness"],"roles":["optional"]},{"critical":false,"fact_id":"financial.balance_sheet_claims","master_ids":["master_graham"],"roles":["optional"]},{"critical":false,"fact_id":"financial.cash_conversion","master_ids":["master_jhunjhunwala"],"roles":["optional"]},{"critical":false,"fact_id":"financial.growth_rate","master_ids":["master_lynch"],"roles":["optional"]},{"critical":false,"fact_id":"financial.inventory","master_ids":["master_lynch"],"roles":["optional"]},{"critical":false,"fact_id":"financial.long_run_economics","master_ids":["master_duan_yongping"],"roles":["optional"]},{"critical":false,"fact_id":"financial.normalized_earnings","master_ids":["master_graham"],"roles":["optional"]},{"critical":false,"fact_id":"financial.reinvestment_runway","master_ids":["master_fisher"],"roles":["optional"]},{"critical":false,"fact_id":"financial.tangible_book_value","master_ids":["master_graham"],"roles":["optional"]},{"critical":false,"fact_id":"fundamental.response_to_price","master_ids":["master_soros"],"roles":["optional"]},{"critical":false,"fact_id":"governance.board_rights","master_ids":["master_ackman"],"roles":["optional"]},{"critical":false,"fact_id":"governance.incentive_structure","master_ids":["master_munger"],"roles":["optional"]},{"critical":false,"fact_id":"governance.integrity_events","master_ids":["master_li_lu"],"roles":["optional"]},{"critical":false,"fact_id":"governance.promoter_ownership","master_ids":["master_jhunjhunwala"],"roles":["optional"]},{"critical":false,"fact_id":"governance.related_parties","master_ids":["master_forensic_short"],"roles":["optional"]},{"critical":false,"fact_id":"governance.related_party_transactions","master_ids":["master_jhunjhunwala"],"roles":["optional"]},{"critical":false,"fact_id":"governance.voting_control","master_ids":["master_ackman"],"roles":["optional"]},{"critical":false,"fact_id":"india.industry_penetration","master_ids":["master_jhunjhunwala"],"roles":["optional"]},{"critical":false,"fact_id":"industry.structural_direction","master_ids":["master_li_lu"],"roles":["optional"]},{"critical":false,"fact_id":"macro.analogue_distance","master_ids":["master_dalio"],"roles":["optional"]},{"critical":false,"fact_id":"macro.forward_inflection","master_ids":["master_druckenmiller"],"roles":["optional"]},{"critical":false,"fact_id":"macro.inflation_regime","master_ids":["master_dalio"],"roles":["optional"]},{"critical":false,"fact_id":"macro.policy_path","master_ids":["master_soros"],"roles":["optional"]},{"critical":false,"fact_id":"macro.policy_stance","master_ids":["master_dalio"],"roles":["optional"]},{"critical":false,"fact_id":"management.depth","master_ids":["master_fisher"],"roles":["optional"]},{"critical":false,"fact_id":"management.promise_record","master_ids":["master_duan_yongping","master_li_lu"],"roles":["optional"]},{"critical":false,"fact_id":"market.addressable_units","master_ids":["master_cathie_wood"],"roles":["optional"]},{"critical":false,"fact_id":"market.liquidity","master_ids":["master_jhunjhunwala"],"roles":["optional"]},{"critical":false,"fact_id":"market.price_confirmation","master_ids":["master_druckenmiller"],"roles":["optio